{
  "title": "普通人的 AI 自由之路：先别卷模型，先把这 3 条工作流跑通",
  "author": "QClaw 运营助手",
  "digest": "给普通人一套真正能落地的 AI 工作流：写作、整理、自动发布。",
  "coverImagePath": "",
  "lead": [
    "很多人一提 AI，第一反应就是去追最新模型、最新参数、最新榜单。",
    "但对大多数普通人来说，真正能改变效率和收入的，往往不是追热点，而是先把一套稳定工作流跑通。",
    "当你开始把 AI 放进可重复执行的链路里，它带来的就不只是新鲜感，而是持续累积的复利。"
  ],
  "quote": "普通人和 AI 拉开差距的关键，不是谁更懂模型，而是谁更早把一条能交付的工作流跑顺。",
  "sections": [
    {
      "heading": "第一步：把重复动作变成固定流程",
      "lead": [
        "很多人效率上不去，不是因为不努力，而是因为每次都在重新起步。"
      ],
      "paragraphs": [
        "高频任务如果总靠临场发挥，注意力会被大量消耗在切换和犹豫上。",
        "更有效的办法，是先把流程拆出来，再决定哪些环节交给 AI，哪些环节保留人工判断。",
        "比如公众号写作，就完全可以拆成选题、大纲、初稿、标题、定稿、发布。"
      ],
      "bullets": [
        "先定义输入模板",
        "再定义输出标准",
        "最后再做自动化连接"
      ],
      "closing": [
        "流程一旦固定，你做的就不再是一次性劳动，而是在搭自己的生产线。"
      ]
    },
    {
      "heading": "第二步：先解决交付，再追求完美",
      "paragraphs": [
        "很多人卡住，不是因为不会，而是因为总想一步到位。",
        "但真实世界的进步，通常来自先把东西发出去，再根据反馈不断微调。"
      ],
      "quote": "先把第一版交付出来，往往比永远停留在准备状态更值钱。",
      "examplesHeading": "你可以先从这些最小闭环开始",
      "examples": [
        "先做一个能稳定产出文章初稿的流程",
        "先做一个能自动整理资料的流程",
        "先做一个能把内容送到目标平台的发布流程"
      ]
    },
    {
      "heading": "第三步：把 AI 变成执行链路，而不是聊天玩具",
      "paragraphs": [
        "当 AI 只能陪你聊天时，它提供的是灵感；当 AI 能连接写作、整理、封面、发布这些环节时，它才开始真正产生杠杆。",
        "一旦链路跑通，你每多写一篇、每多发一次，边际成本都会继续下降。"
      ],
      "actionHeading": "如果你想开始，可以先做这三件事",
      "actionItems": [
        "挑一个你每周都会重复做的任务",
        "把它拆成清晰的输入、处理、输出",
        "只自动化最机械、最重复的那一段"
      ]
    }
  ],
  "conclusion": [
    "普通人的 AI 自由，不是拥有最强模型，而是拥有一套能持续复用、持续交付的系统。",
    "先跑通一条小链路，你会比继续观望的人快很多。"
  ],
  "cta": "如果你也在搭自己的 AI 工作流，欢迎留言聊聊你最想先自动化的环节。"
}
